{
  "schema_version": "2.0",
  "model": {
    "provider": "ollama",
    "id": "gemma4:e2b"
  },
  "environment": {
    "tbl_version": "git-a2a38b9",
    "prompt_version": "v1"
  },
  "contributors": [
    {
      "by": "github:hydropix",
      "at": "2026-05-10T16:01:28Z"
    }
  ],
  "translations": [
    {
      "text_id": "aurelius_meditations",
      "source_lang": "en",
      "target_lang": "ar",
      "output": "افعل يا روحك، اسوؤ نفسك واستخف بها؛ ولكن قريباً، وحين يحين وقت احترامك لنفسك، سيأتي وقت الانتهاء. سعادة كل رجل تعتمد عليه هو هو، ولكن انظر إلى حياتك التي أوشكت على الانتهاء، بينما لا تمنح نفسك أي احترام، فإنك تجعل سعادتك تتكون من أرواح وممتلكات الآخرين. لماذا يجب أن تشتت انتباهك كل هذه الأشياء الخارجية إلى هذا الحد؟ امنح نفسك وقتًا لتعلم شيئًا جيدًا، وتوقف عن التجول والتردد.",
      "output_hash": "sha256:d7b709cd3a65ea76d6214ec67d238e3b5459e8a69f60fc6491bf724ec4af0c1d",
      "translation_latency_ms": 918,
      "produced_at": "2026-05-10T16:01:28Z"
    },
    {
      "text_id": "aurelius_meditations",
      "source_lang": "en",
      "target_lang": "bn",
      "output": "কর, আত্মা, করো; নিজেকে অপব্যবহার ও অবজ্ঞা কর; তবুও এক সময় আসবে, যখন তোমার নিজেকে সম্মান করার সময় হবে। প্রত্যেক মানুষের সুখ তার নিজের উপর নির্ভর করে, কিন্তু দেখো তোমার জীবন প্রায় শেষ, অথচ নিজেকে কোনো সম্মান দিচ্ছ না, তুমি তোমার সুখকে অন্যের আত্মা এবং প্রশংসাগুলিতে নিবিষ্ট করছ। বাহ্যিক এই জিনিসগুলি কেন তোমাকে এত বিভ্রান্ত করবে? নিজেকে কিছু ভালো জিনিস শেখার অবকাশ দাও, এবং আনাগোনা ও ঘুরে বেড়ানো বন্ধ কর।",
      "output_hash": "sha256:e9fd3f5e50ee5a5fe4c3efd5948a51bb85add40c2e85c152ade8e316352be1eb",
      "translation_latency_ms": 793,
      "produced_at": "2026-05-10T16:01:28Z"
    },
    {
      "text_id": "aurelius_meditations",
      "source_lang": "en",
      "target_lang": "da",
      "output": "Gør, sjæl, gør; misbrug og forakt dig selv; men snart vil tiden komme, hvor du kan respektere dig selv. Enhver mands lykke afhænger af ham selv, men se, dit liv er næsten forbi, mens du ikke giver dig selv respekt, gør du din lykke af at fokusere på andres sjæle og bedømmelser. Hvorfor skal nogen af disse ting, der sker ydre, så distrahere dig? Giv dig selv fritid til at lære noget godt, og stop med at vandre frem og tilbage.",
      "output_hash": "sha256:6dabdac72f82921f99566aa6f7071f4f3b4872d289aecaea232da2aafb9014d3",
      "translation_latency_ms": 960,
      "produced_at": "2026-05-10T16:01:28Z"
    },
    {
      "text_id": "aurelius_meditations",
      "source_lang": "en",
      "target_lang": "de",
      "output": "Tu, Seele, tue; missbrauche und missachte dich selbst; doch eine Weile und die Zeit, die du dich selbst respektieren kannst, werden enden. Das Glück jedes Einzelnen hängt von ihm selbst ab, aber sieh dir an, dein Leben ist fast vorbei, während du dir keinen Respekt gewährst, machst du dein Glück aus den Seelen und Begierden anderer Menschen. Warum sollten dich all diese äußeren Dinge so sehr ablenken? Gib dir die Zeit, um etwas Gutes zu lernen, und hör auf, hin und her umherzuirren.",
      "output_hash": "sha256:90378efb1f24961e35506eca82ca8b55919b1a195d2b10bfeb7dfa0566b0853f",
      "translation_latency_ms": 955,
      "produced_at": "2026-05-10T16:01:28Z"
    },
    {
      "text_id": "aurelius_meditations",
      "source_lang": "en",
      "target_lang": "el",
      "output": "Κάνε, ψυχή, κάνε· βασάλεψέ σε και κατέξεφτε σε· αλλά μια στιγμή και η ώρα που θα σε τιμήσουν, θα τελειώσει. Η ευτυχία κάθε ανθρώπου εξαρτάται από τον εαυτό του, αλλά κοίτα, η ζωή σου είναι σχεδόν στο τέλος, ενώ δεν σε τιμάς, κάνεις την ευτυχία σου να αποτελείται από τις ψυχές και τις επιθυμίες των άλλων. Γιατί πρέπει να σε αποσπείει οτιδήποτε εξωτερικό συμβαίνει, τόσο πολύ; Δώσε στον εαυτό σου χρόνο να μάθει κάτι καλό, και σταμάτα το περιπλανώμενο και το παίρνοντας.",
      "output_hash": "sha256:8a1fd467a190a7f4c0e272efc84d38153aed4e50c17013eb9d8c3e525d819cd6",
      "translation_latency_ms": 1126,
      "produced_at": "2026-05-10T16:01:28Z"
    },
    {
      "text_id": "aurelius_meditations",
      "source_lang": "en",
      "target_lang": "es",
      "output": "Haz, alma, haz; abusa y contiende contigo mismo; pero un tiempo y el momento para que te respetes, llegará a su fin. La felicidad de cada hombre depende de él mismo, pero mira que tu vida está casi al final, mientras no te das respeto, haces que tu felicidad consista en las almas y los deseos de otros hombres. ¿Por qué deberías distraerte tanto por las cosas que suceden externamente? Date el ocio para aprender algo bueno, y cesa de andar de un lado a otro.",
      "output_hash": "sha256:fdf1b68e9943746696dcda90b726c0e27175750d38bab0cbb29cfeae9a6e9bf7",
      "translation_latency_ms": 870,
      "produced_at": "2026-05-10T16:01:28Z"
    },
    {
      "text_id": "aurelius_meditations",
      "source_lang": "en",
      "target_lang": "fr",
      "output": "Fais, âme, fais ; abuse-toi et méprise-toi ; mais un temps et le moment pour te respecter arriveront. Le bonheur de chacun dépend de lui-même, mais vois que ta vie est presque terminée ; pendant que tu ne te donnes aucun respect, tu fais en sorte que ton bonheur consiste dans les âmes et les plaisirs des autres. Pourquoi ces choses qui se produisent extérieurement te distraient-elles tant ? Donne-toi du temps pour apprendre quelque chose de bon, et cesse de t'errer et de te promener.",
      "output_hash": "sha256:6f2f49e1e76bfaee1af1972b74517e64340df7404d4927fc64e39c3c92551b80",
      "translation_latency_ms": 938,
      "produced_at": "2026-05-10T16:01:28Z"
    },
    {
      "text_id": "aurelius_meditations",
      "source_lang": "en",
      "target_lang": "he",
      "output": "עשה, נשמה, עשי; התעלל והתייחס לעצמך בחוסר כבוד; אך זמן וזמן שיכבדת את עצמך, יגיע לסיומו. אושר כל אדם תלוי בו, אך הנה חייך כמעט בסוף, בעוד שאינך מעניק לעצמך כבוד, אתה הופך את אושרך להיות מורכב נשמות והתעניינים של אחרים. מדוע כל הדברים האלה שקורים מבחוץ מסיחים אותך כל כך? תן לעצמך מנוחה ללמוד משהו טוב, והפסק להסתובב ולתהלל הלוך ושוב.",
      "output_hash": "sha256:0415d9bf938e8f77db6ca23e3d291bc4ba661a075d0068d36270b296f0ecf6d9",
      "translation_latency_ms": 1057,
      "produced_at": "2026-05-10T16:01:28Z"
    },
    {
      "text_id": "aurelius_meditations",
      "source_lang": "en",
      "target_lang": "hi",
      "output": "कर, आत्मा, कर; स्वयं का दुरुपयोग और तिरस्कार कर; फिर थोड़ी देर में ही तुम्हारा स्वयं का सम्मान करने का समय समाप्त हो जाएगा। हर व्यक्ति की खुशी उसी पर निर्भर करती है, परंतु देखो, तुम्हारा जीवन लगभग समाप्त हो रहा है, जबकि तुम स्वयं का कोई सम्मान नहीं करते, तुम अपनी खुशी दूसरों की आत्माओं और प्रशंसाओं में पाते हो। इन बाहरी चीजों में से किसी बात से तुम्हें इतना विचलित क्यों होना चाहिए? स्वयं को कुछ अच्छा सीखने के लिए विश्राम दो, और इधर-उधर भटकना बंद कर दो।",
      "output_hash": "sha256:7cc9eebc403556fa6ea2fbf32651e35ab65187a1561684bb36b7229b146363bc",
      "translation_latency_ms": 859,
      "produced_at": "2026-05-10T16:01:28Z"
    },
    {
      "text_id": "aurelius_meditations",
      "source_lang": "en",
      "target_lang": "id",
      "output": "Lakukanlah, jiwa, lakukanlah; sakiti dan hina dirimu sendiri; namun sebentar lagi dan waktu bagimu untuk menghormati dirimu sendiri, akan berakhir. Kebahagiaan setiap orang bergantung pada dirinya sendiri, tetapi lihatlah hidupmu hampir berakhir, sementara kamu tidak memberikan rasa hormat pada dirimu, kamu membuat kebahagiaanmu terdiri dari jiwa dan keinginan orang lain. Mengapa hal-hal eksternal ini yang terjadi, begitu mengalihkan perhatianmu? Beri dirimu waktu luang untuk mempelajari sesuatu yang baik, dan hentikan berkelana dan mengembara ke sana kemari.",
      "output_hash": "sha256:eb877800009b864336b88eac79e9713769602779f486b2ee9cc3e49663bf2220",
      "translation_latency_ms": 978,
      "produced_at": "2026-05-10T16:01:28Z"
    },
    {
      "text_id": "aurelius_meditations",
      "source_lang": "en",
      "target_lang": "it",
      "output": "Fai, anima, fai; abusa e derisoti te stesso; ma un po' di tempo e il momento per rispettarti finiranno. La felicità di ogni uomo dipende da sé stesso, ma guarda, la tua vita è quasi finita, mentre non ti concedi rispetto, fai sì che la tua felicità consista nelle anime e nei desideri degli altri. Perché dovresti essere distrutto da tutte queste cose che accadono esternamente? Concediti il tempo di imparare qualcosa di buono e smetti di vagare avanti e indietro.",
      "output_hash": "sha256:90582581fcc4b86186629b3058817fef14c3c056ce218a2600494be8101b87d6",
      "translation_latency_ms": 868,
      "produced_at": "2026-05-10T16:01:28Z"
    },
    {
      "text_id": "aurelius_meditations",
      "source_lang": "en",
      "target_lang": "ja",
      "output": "行え、魂よ、行え。自らを虐げ、軽蔑せよ。されど、汝が自らを尊重する時間も、そのための時も、やがて終わりを迎えるであろう。人の幸福はすべて自分自身にかかっているが、見よ、汝の人生はほとんど終わりを告げている。それなのに自らを尊重しないお前は、幸福を他人の魂や私欲に委ねている。なぜ、これら外的な出来事のどれが、お前をこれほどまでにそらさせる必要があるのか？良いことを学ぶための余暇を与えよ、そして行き来し、さまよいを絶て。",
      "output_hash": "sha256:e8172b7bb93451abba42a343ff519e0549ea7f152176a562d6e47f42f233c2e7",
      "translation_latency_ms": 934,
      "produced_at": "2026-05-10T16:01:28Z"
    },
    {
      "text_id": "aurelius_meditations",
      "source_lang": "en",
      "target_lang": "ko",
      "output": "하라, 영혼아, 하라; 너 자신을 학대하고 경멸하되, 잠시 후에 네가 스스로를 존중할 시간이 올 것이다. 모든 사람의 행복은 그 자신에게 달려 있지만, 보라 네 삶은 거의 끝났는데도 너는 스스로에 대한 존중을 베풀지 않고, 다른 사람들의 영혼과 허영에 너의 행복을 두려 하고 있다. 외부에서 일어나는 이러한 일들이 어찌 너를 그렇게 산만하게 하는가? 너 자신에게 좋은 것을 배울 여유를 주고, 이리저리 방황하며 돌아다니는 것을 멈추어라.",
      "output_hash": "sha256:90533dcd013525e8ad7fb5c58119242fc162a7fd053b710efac8d9733a398716",
      "translation_latency_ms": 945,
      "produced_at": "2026-05-10T16:01:28Z"
    },
    {
      "text_id": "aurelius_meditations",
      "source_lang": "en",
      "target_lang": "nl",